{
  "name": "product-manager",
  "version": "0.1.1",
  "description": "Product management toolkit for authoring PRDs and turning them into executable, agent-ready implementation plans.",
  "author": {
    "name": "Brian Weisberg"
  },
  "homepage": "https://github.com/weisberg/agile_agentic_analytics/tree/main/plugins/product-manager",
  "repository": "https://github.com/weisberg/agile_agentic_analytics",
  "license": "MIT",
  "keywords": [
    "product-management",
    "prd",
    "spec",
    "agentic-planning",
    "implementation-plan"
  ],
  "skills": "./skills/",
  "interface": {
    "displayName": "Product Manager",
    "shortDescription": "Write PRDs and turn product ideas into implementation plans.",
    "longDescription": "Product Manager ships two skills: prd-writer authors and critiques PRDs, specs, one-pagers, and PR/FAQs; prd-to-plan converts a PRD into a structured PLAN.md for agentic execution with phases, tasks, dependencies, and validation gates.",
    "developerName": "Brian Weisberg",
    "category": "Developer Tools",
    "capabilities": [
      "Read",
      "Write"
    ],
    "websiteURL": "https://github.com/weisberg/agile_agentic_analytics/tree/main/plugins/product-manager",
    "brandColor": "#2563EB",
    "defaultPrompt": [
      "Help me write a PRD or turn product work into an implementation plan."
    ]
  }
}
